{
  "BASE_PRICES": {
    "potion": 10.0,
    "elixir": 15.0
  },
  "EFFECT_MULTIPLIERS": {
    "healing": 1.5,
    "strength": 2.0,
    "speed": 1.2
  },
  "INGREDIENT_COSTS": {
    "herb": 1.0,
    "crystal": 2.5,
    "dust": 0.5
  },
  "RULES": {
    "herb": {
      "add_effect": "healing"
    },
    "crystal": {
      "add_effect": "strength"
    },
    "dust": {
      "add_effect": "speed"
    }
  },
  "PRODUCTION_COSTS": {
    "fixed": 0.25
  }
}